product_id,rating,review_text
108764,5,addition shampoo made hers fell love bought second time give shine hair smell like ginger hers size neither large small middle size cause hair loss mean become one essential shampoo life try mask following hopefully come good expectation please patient please like thank addicted site take advantage offer took offer stay month use lot smell like hers liked size suitable
108764,5,smell sweet good use two squeezed enough lot foam put hair directly let hair breathe frankly part go back take two box finish loving take mask like benefit red heart
108764,5,smell acceptable good use use twice week strong hair removed fat follicle need twice week excellent cleaning quality excellent natural material size suitable enough long period life use cleanliness shine hair combination rosary mint clean scalp
108764,5,shampoo bitter smell sweet sweet improves smell rosary mint strange smell pleasant color liquid white transparent true foam clean hair hair greasy wash twice sweet moisturizing oil mean
108764,5,natural scent hers pleasant even though i'm wa feel shiny smooth next day even using expensive shampoo condition beauty salon recommended feel good time continued use start feel unsatisfactory? maybe using shampoo wrong way? first time i've felt satisfied using using shampoo month regular hairdresser told ``my hair longer friday!'' i'm happy would like continue using product purchase good price coupon
108764,5,smell sweet pleasant liked use easy refreshed hair size medium come without packing color liquid white sticky clean hair fluff foam need two three pressure depending length hair density frankness excellent hair recommend mask group growing heart growing heart
108764,5,awesome amazing lot word can't justice honest friend hair improved hair thickened frankly need lot advertising amazing smell good important thing take entire package benefit lot amazing hair straightened hair smell nice lively red heart red heart red heart red heart red heart red heart red heart red heart red heart red heart red heart red heart red heart red heart red heart red heart red heart red heart red heart red heart red heart red heart red heart
108764,5,best brand hair shampoo put scalp wash justly volume enough frankly whose hair long normal daily use benefit shampoo reduces hair loss experience give moisturizing hair
108764,5,smell refreshing bad use almost daily quality excellent even ingredient sweet size enough one person 3 month one person maybe month! packing practical benefit make hair moisturized radiant scalp breathes hair dry moisturizing balanced suitable hair problem eczema psoriasis wound like may god make happy
108764,5,shampoo top 3 list cleansed well hair felt bit dry clean soft light smell mint rosary singly feeling scalp father lot little go long way hope review helped red heart
108764,5,chin shampoo take together oil result chin main component shampoo following property refreshing soothing scalp mint extract refreshing property create feeling coolness soothing scalp especially helpful scalp irritation seborrheic dermatitis strengthens hair rosary improve blood circulation hair follicle help strengthen hair stimulate hair growth also contains antioxidant protect hair damage free radical aroma effect aroma mint rosary create pleasant smell add feeling freshness cleanliness thanks like
108764,5,hair dyed need lot care dye end became dry brittle first use shampoo conditioned hair became moisturized smooth!! seriously first use notice difference! scent rosary shampoo conditioned refreshing! size price great quality great age used everyone except child course little hot scalp! packing excellent benefit first use dyed hair liked composition product especially since love rosary personal experience great benefit! please note sensitive hair scalp formula people sensitive rosary him!
108764,5,clean scalp well well dry hair sensitive scalp moisture give shine hair help grow new hair scalp also price compared size perfect use love scent it’s fresh rosary sent high quality nice packing!!
108764,5,congratulation ukraine rate red heart thumb light skin tone bought shampoo great review regret heart hand medium light skin tone really really cool! gentle fresh smell good composition clean perfectly scalp becomes cleansed moisturized hair shine definitely recommend shampoo also want try serum series also packing convenient dispense
108764,5,cool make scalp clean cause dryness hair great product definitely want talk lot really worth buying like comment like available buy lot secure
108764,5,massaged small amount scalp directed since long hair little worried lack lather shampooing rinsing scalp felt refreshed hair creak satisfied moisturized smooth finger
108764,5,shampoo great cleansed hair scalp without stripping hair natural oil also strengthens hair strand promotes hair growth i’ve using shampoo almost two year since using hair become fuller longer
108764,5,oily scalp started using two week ago 3 day per week misty smell feel good apply keep scalp clerk fresh le greasy love keep using
108764,5,god bless grant peace upon muhammad first thing testimony regarding rosary product love never without whether shampoo conditioned oil even herb smell acceptable use twice week quality wonderful size good useful everyone packing sweet benefit clear wonderful composition oil delicate aromatic moisturizing hair excellent hair nourishment
108764,5,shampoo smell sweet first use mint rosary use feel sense freshness suitable everyone hair loss reduced treat scalp composition beneficial hair softness moisturizing high quality recommend try order conditioned available hope use shampoo feel result effective package size suitable
108764,5,shampoo wonderful true sense word hair dry curly result third use vitality shine softness hair tried many organic shampoo experience distinct everyone highly recommend became favorite shampoo never change
108764,5,smell pleasant quality excellent use cleansed scalp applied wet hair benefit get rid dandruff clean scalp also increase hydration feeling sensitive stop using size 355 my shine crazy like please heart hand
108764,5,best shampoo lotion hair recommend amazing rosary rosary herb known benefit hair strengthens lengthen softens hair advise use girl take whole set growing heart use bubonic drinking pill took herb smell nice use daily high quality average size average lifespan one month two month package excellent benefit lengthening tapping strengthening hair rosary formula humane protects treat scalp sensitive moisturizes concern
108764,5,passed crazy smelled like rosary mint felt difference length wet hair put scalp rub leave like least 5 minute rise use conditioned feel suit everyone
108764,5,came across package tie toy longer's review oil series decided try three product hair oil shampoo mask considering composition quality product quite good immediately note smell incredible rosary mint really liked it! regard use noticed significant increase hair growth usually added thickness
108764,5,quantity excellent enough 3 month repeated use smell somewhat acceptable quality excellent product honestly need praise known size excellent 1 greatly strengthens hair increase length density treat scalp suitable sensitive hair give sweet moisturizing highly recommend product
108764,5,rosary effective rejuvenation hair growth hair care gallery also attracting attention herb improves concentration memory plant effective alzheimer's disease atkinson's disease rosary stringent effect skin applied scalp act stringent expected effect hair growth hair care shampoo refreshing rosary scent comfortable use
108764,5,38 year old hair quite weak thin brittle constantly looking good care product unfordable price decided try whole line i’m pleased! didn’t expect result hair soft manageable wash hair le often doesn’t dry scalp hair doesn’t get fat often smell light unobtrusive use convenient due dispense consumption economical i'm happy result! i've already ordered cause problem pregnancy health everyone!
108764,5,shampoo contains olin sulfonate remove dirt gentle way sodium laurel surface cause irritation gentle scalp indeed shampoo cleansed well hair feel dry misty smell scalp feel refreshed usage definitely purchase
108764,5,despite using mille shampoo twice week hair remained healthy hydrate ingredient shampoo effective keeping hair soft conditioned without dryness leakage since starting use shampoo noticed hair feeling wealthier shining looking full would definitely recommend like please purple heart purple heart
108764,5,like scent rosary mint refreshing foam well mean going hit? washed wash well sure dirt scalp removed properly last 3 4 day combination conditioned mask set cream regardless feeling use surprised see hair tends flat due fine soft hair became fluffy voluminous heart exclamation continue use heart exclamation
108764,5,third time purchased time ordered 2 bottle straight away also use mask scalp oil every two week good smell use twice week good quality bottle come medium size convenient packing pump oily waste material thick rich texture cleansed enriched moisture hair sensitive broken faded weak straightening tilting shedding using month hair feel great healthy positive say product suitable age daughter also like product
108764,5,one best shampoo tried herb needling originally mild brand product amazing smell nice refreshing taste hers mint course rosary best plant hair mint excellent scalp cleansed moisturizing percentage never dry hair color almost transparent white size nice use conditioned oil hair mask get amazing result red heart
108764,5,product get consistency pearlescent milky color aroma cool! smell like hers smell mint little rosary chamomile ginger general smell wonderful really appeal lover natural sebaceous aroma wish hair perfectly opinion suitable type hair dry oily give hair volume make manageable smooth shiny beautiful tangle hair washing! say work hair loss mmm problem yet hair straightens split end become invisible
108764,5,comfortable use expected hair firm also fine wavy making difficult manage also concerned smell scalp keep trying different shampoo replacing hit long time used hair felt well managed soon rinsed shower slim foam came easily next morning hair wavy well managed able go little care evening notice scalp odor bothering shampoo faintly refreshing scent linger hair happy scalp odorless next day seems suit plan continue using longer
108764,5,suffered alopecia great many time year tried many different product due severe hair loss caused menopause shampoo great used shampoo together oil series hair loss decreased significantly
108764,5,scent rosary mint refreshing washing moisturizing refreshing since pump locked prevents child tapering good take traveling
108764,5,first scent nice feel like moisturizer refreshing one leaving hair shiny supple ingredient safe feel effective hair also scalp look forward continuing use seeing result
108764,5,scent different rosary i've used far grassy rosary scent looking typical rosary scent might looking sensitive skin use shampoo suit get pimple shampoo worked without problem also easy wash feel like catching hair
108764,5,recently hair changed become thinner le firm i've also developed alopecia great found shampoo! scent bothersome father well there's squeaky feeling washing feel smooth! moisturizing size right! leaf scalp feeling refreshed!
108764,5,shampoo trend ok hand light skin tone ok hand light skin tone smiling face heart eye number one list available disappears day rosary rosary known powerful benefit hair free chemical harmful substance need smell overwhelming mint size appropriate plentiful packing economical good hair scalp cleaning well quality definitely excellent social medium cerebritis strong a mild hair product whose hair thin falling benefited shampoo using rest product order soon available hope benefit treating hair problem thumb light skin tone thumb light skin tone thumb light skin tone
108764,5,amazing used month method using twice week first shampoo mask follows hair dry completely put rosary mint oil group benefit strengthens hair feel hair become softer size enough two month month half depending use quality great smell mint note scalp sensitive felt little moisturizing hair
108764,5,hair thin semi long gotten thinner i've gotten older wavy bought hope hair growth improving fritz thick shampoo one half pump one teaspoon creates fluffy foam scent still rosary mint refreshing hair stay together well day go flat evening fritz improved time purchased shampoo next time i'll buy conditioned well great! p three day using shampoo initial impression decreased seems using combination oil suit
108764,5,smell gentle rosary use 2 3 time week quality texture strengthen hair short period time hair became lush pleasant without shedding size bottle small suck simply excellent benefit healthy hair without shedding delicate texture stunning restored hair
108764,5,use hair feel moisturized bounty gentle scalp feel like hair quality improving smell like rosary slightly greenish smell father well need use much rosary formula also good scalp i'd like continue using
108764,5,effective shampoo hair growth! hard time finding shampoo saved severe hair loss lot new one doesn’t smell overpowering pleasant convenient dispense packing doesn’t foam much wish hair perfectly super quality perfect composition hair look healthy
108764,5,shampoo surface free ordered accident surprise! soft surface free wish well foam perfectly clean 2 time expected turn hair straw oh yes smell smiling face heart eye lover rosary fresh smell hair enter
108764,5,well pain clean hair notice germination strengthening ingredient shampoo nice recommend trying buying consider one favorite company’s product beautiful wonderful vitality hair luster recommend
108764,5,fruit greasy suit dried cleaned smell beautiful beautiful everything sweet worth try like please red heart
108764,5,mille rosary mint strengthening shampoo offer refreshing invigorating experience aromatic blend rosary mint combination provides pleasant scent strengthening formula leaf hair feeling clean devitalised effectively cleansed without stripping natural oil promoting wealthier resident strand overall solid choice seeking nourishing aromatic shampoo
108764,5,tried lot different product herb one found first scent great! leaf soft scent size also good small feel expensive good price feel moist blind well hair lot hair bit hard easy wash ingredient gentle really good bought could greedy wish label would attached firmly wrinkled
108764,5,wild scent like lie grass shampooing personally find favorite scent soothing think feel ingredient good packing also cut put bath get excited use line series effective
108764,5,i've following curly girl method almost 3 year discovering product worked best hair type hair fine highlight little density product immediately get dirty give weight follow method simple uncomplicated way suitable product natural ingredient possible like giovanni's botanical ingredient mille's mint rosary line excellent discovery along curlsmith using saying cream line long time herb sell buy spain seems smooth respectful line need hair chemical sensitivity decided try shampoo say finally found shampoo dry pitch weigh anything tried several she moisture shampoo love giovanni one fulfill much better looking shampoo usually coast fine hair build lot give weight quite natural smell mint rosary seems colorants appreciated dispense bottle success repeat without doubt! totally recommended !! found comment useful appreciate giving thumb thanks!
108764,5,i've used many shampoo one different feel anything i've ever used leaf scalp feeling refreshed leave smoothing sensation skin father really well chemical feel hair left soft light shiny finish also recommended men concerned thinning hair
108764,5,using another company's bitten shampoo stock long time tried one feel squeaky washing great cleansing power strong leave much scent behind i'm wa i've noticed le hair loss!
108764,5,smell acceptable need introduction method use quality excellent size appropriate benefit moisturizing scalp suitable hair liked product lot lot lot lot lot lot lot lot lot lot lot lot lot many many many many many many many many many many many many many many many
108764,5,bought hair mask company honestly skeptically result dry friday hair excellent! decided also buy shampoo line quality ingredient composition everything excellent result visible almost immediately recommend!
108764,5,shampoo work well hair use combination mask line first first time use understand effect time hair began look great improved structure alternate shampoo dry hair hair general becomes le greasy shiny loss decrease
108764,5,smell good used three time week quality good size suitable two month age preferred adult 16 package benefit portfolio benefit clean refreshed formula rosary mint hair dry scalp refreshing sensitive moisturizing
108764,5,smell beautiful light use every time shower use high quality size middle aged expect two month left packing suitable easy use benefit two week still result excellent composition hair scalp gentle sensitive moisturizing need lot conditioned soft hair shower feel fluffy
108764,5,shampoo designed moisture nourish strengthen hair thanks composition containing bitten hers stop hair loss reduces fragility! addition bitten composition contains extract essential oil settle mint rosary horsetail ginger chamomile godfrey well nourishing babassu castor coronet oil
108764,5,company taking literally product nothing left complete except get unfortunately available escape don’t know get important thing shampoo nice lengthen hair quickly contains rosary clean scalp heart make moisturized felt dry hair even though put scalp
108764,5,great product! quality really great! packing large composition wonderful suitable damaged dry hair smell mint rosary unobtrusive moisturizes scalp began look better suitable sensitive skin shampoo give good result used together mask using shampoo mask 4 month already satisfied product recommend thumb light skin tone
108764,5,bought hair kept getting tangled falling rosary scent refreshing nice father well leaf scalp feeling refreshed feel stiff shampooing stay moisturized hair fall much feel like getting richer intend purchase
108764,5,"bought reading review rosary mint thought would refreshing scent gentle rosary scent aromatic like scent worried saw review saying squeaky feel squeaky without conditioned might hard use shampoo i'm glad bought conditioned set friend said ""your hair shiny! use conditioned?"" might effective making shiny i've used salon exclusive shampoo one cost effective wash manageability good i'm thinking buying size big right"
108764,5,haven’t used using oil sometime right many new baby hair !! suffering hair loss rosary helped ! continue keep buying ! amazing scent nice !
108764,5,one best shampoo tried far hair use shampoo combination mille rosary mint oil using couple week see baby hair growing feel growth hair boasted
108764,5,excellent shampoo addition bitten smell rosary mint leaf hair soft use apply rosary hair mask series good size really long hair use relatively large amount shampoo wash recommended! liked review give like smiling face smiling eye
108764,5,good surface shampoo aggressive give volume hair composition excellent fine curly dry hair
108764,5,holy grain shampoo!!! cleansed scalp really well i’ve noticed drying oily scalp reference dry hair bottle last 2 3 month wash hair frequently show little go long way shampoo
108764,5,yet use heard lot good thing decided get 2 shampoo cell fast wait month stock smell pleasant
108764,5,wanted get rosary oil shampoo caught attention expected quality would excellent case oil bought use conjunction use oil shampoo distinct combination rosary mint thus help moisture scalp relieve itching well contributes nourishing follicle thus making hair healthy vagrant put little shampoo hand wet hair massage scalp end well shampoo father well cause dry hair smell nice refreshing mixture rosary mint size package average shampoo enough month used continuously
108764,5,excellent asked praise everyone rosary settle sweet foam fluff hair feel hair moisturized dry scent desirable
108764,5,smell really good lather much smooth think refreshing feel good use used combination hair mask dry hair becomes smooth smooth
108764,5,30 year old hair type friday due dye hair year bc white hair used thousand expensive treatment shampoo almost gave help friday hair finally decided buy shampoo every time wash say let try make sure real guess miracle can believe washing th time second week can stop playing hair mind accepting seeing le hair fall soft hair without blow dry
108764,5,great shampoo becomes favorite since help reduce hair loss fritz hair well package easy use bottle medium size bottle last month need little bit
108764,5,great shampoo used damaged hair suffered hair loss long time ago shampoo come suitable ingredient help problem contains rosary mint applied scalp origin hair let set wash hair well let feel fresh clean hair grow strongly recommend
108764,5,looking organic shampoo purchased shampoo nice aroma prepared saw people saying kissed review used felt moisturizing liked much i'm thinking repeating
108764,5,tried seven eight different band shampoo none solved problem itchy scalp dandruff bought mille strengthening shampoo idea giving try using time felt good light refreshing scent hair dry feel moisturized touch happy
108764,5,worried would inconvenient carry around pump type since container lockable easily carry around go swimming pool sometimes hair loss shampoo become bit stiff use think product okay got older realized importance hair bought preventive measure
108764,5,absolutely love using 4 month it’s really good curly hair smell really good doesn’t clean scalp good first wash wash twice it’s good sensitive hair moisturizers
108764,5,good clean moisturizes strengthens nourishing component dry hair little important deep moisturizing conditioned shampoo package contains wonderful formula stop hair loss stimulate hair growth volume sufficient good use period month smell refreshing clean scalp
108764,5,nice scent like also served substitute aroma able relax taking relaxing bath repeated
108764,5,love rosary shampoo mille brand cleansed hair really well verbal scent massage hair feel like stimulated scalp noticed hair fall decreased consistent use love whole rosary line brand
108764,5,tried praise lord benefited according read excellent component useful hair oily scalp rosary benefit known hair
108764,5,cool cause dry hair necessary use moisturizing ball serum suitable age clean scalp effectively
108764,5,using product say one amazing product used! red heart perfect rosary mint smell super good quality reasonable size suitable age really convenient packing benefit strengthens hair fibre prevents shedding pleasant texture help scalp hair! really recommend
108764,5,refreshing scent gentle hair make hair shiny
108764,5,first purchase product ordered solution oily scalp due hormonal change turned fabulous! first wash left scalp clean fresh like product i've tried length hair left soft manageable without dryness middle end composition totally verbal aroma subtle pleasant highly recommend
108764,5,trouble bald hair tried using shampoo thick thick hair long enough used 2 time using month like smell stringent dry feeling
108764,5,took oil shampoo smell normal use massage entire hair shampoo scalp size suitable price packing excellent
108764,5,shampoo excellent clean scalp hair well smell acceptable smell tea tree size quantity reasonable suitable daily use
108764,5,father well moist texture right amount gloss without squishy washing feel like dirt skin also properly removed scent mint rosary well balanced strong
108764,5,nice shampoo bought entire line strengthening hair root work complex earache length hair dry scalp sensitive get oily quickly liked shampoo smell verbal neutral use quite economical thick foam well washing length hair moisturized even using mask
108764,5,thick liquid clean green scent make easy use rise well without roughness using conditioned series left hair silk smooth make scalp itchy reduces hair loss think good shampoo
108764,5,i'm wa thick full toned damaged hair product father really well great cleansing power despite made natural ingredient strong great job removing dirt hair also moisturizing safe apply scalp washed hygienic use scent best say least hair still moisturized next morning felt amazing using i'll definitely buying again!!
108764,5,quality ingredient great size okay cleansed scalp dry hair give light hydration benefit rosary great
108764,5,lot praise site blow recommend number one curly coarse hair clean scalp heart sensitive scalp suit moisturizes hair dry better use hair mask brand smell acceptable benefit moisture hair healthy growth please rate thumb tiredness
108764,5,took 2 crazy cold horn full protein hair lengthen smell acceptable daily use quality excellent size small age two month package full benefit lengthening thickening combination rosary mint scalp clean sensitive
108764,5,daughter love shampoo thin greasy hair i’ve stocked two bottle since it’s best we’ve tried also prevents hair loss highly recommend!
108764,5,rich aroma come great size use daily hair notice big difference scalp cleaner le sensitive better moisturized product package arrived sealed quality expected benefit noticeable composition
108764,5,quantity lot enough long time loved smell make hair feel soft stop hair loss
108764,5,first worried kind smell would smell really good! also father really well 2 pump
108764,5,rare smell quality packing delicate texture moist suitable sensitive skin suitable moisture age 20 use size advantage frequency
