product_id,rating,review_text
124721,5,great conditioned quality smell give mint moisturizing honestly amazing softens hair felt difference hair dry dyed lot give excellent moisturization leave hair 3 minute rise water usage use entire set conditioned shampoo conditioned size package large
124721,5,conditioned rich bitten ingredient help increase hair length enhance overall health thanks enhanced formula rosary peppermint conditioned moisturizes hair scalp making easier style making softer important feature completely free parade surface mineral oil short ideal choice improve improve health hair natural safe way advise use entire line shampoo mask serum get best result like please heart hand light skin tone growing heart
124721,5,rosary scent easy use high pettiness size considered good packing nice good benefit hair formula stimulated scalp becomes long thick
124721,5,mile strengthening conditioned rosary blend become staple hair care routine conditioned simply amazing rosary blend leaf hair smelling fresh invigorating also provides deep nourishment strength lock i've noticed significant reduction hair leakage improved manageability since using product formula lightweight weigh hair yet leaf feeling soft smooth incredibly healthy looking conditioned promotes strong lustrous hair mile strengthening conditioned rosary blend must try
124721,5,recently maybe i'm getting older hair quality changed i've started worry hair loss bought shampoo mask buy conditioned time bought too! really like series scent! i'm thinking using mask le frequently using conditioned instead! size appearance small feel thick need small amount think price reasonable moisturizes give firmness! also good scalp recommend it! leaf refreshing finish think perfect coming season!
124721,5,smell permanent use quality amazing size suitable use age packing appropriate benefit great amazing comprehensive formula cause allergic reaction skin gentle smooth repeated twice week concern using highly recommend hesitate buy highly recommend buying wonderful product first time bought regularly
124721,5,product looking lot internet pleasantly surprised me! within week see result really pleasant use hair smell rosary god need talk quality must heard quality simply excellent! sufficient size smooth texture revitalizes hair moisturizes hair sensitive scalp full benefit nice packing also suitable age check first
124721,5,even washing hair already felt good touch drying became shiny firm even smooth wanted touch time!
124721,5,it’s good may smell strong get job done well scalp don’t put scalp shouldn’t use hair mask shampoo packing perfect you’re hair can’t sensitive use you’re end moisturizes hair
124721,5,bought set shampoo scent aromatic like lot review saying hair dry used creak washed felt really smooth drying! i'm thinking repeating
124721,5,use together shampoo heavy sticky scalp feel refreshed even two day scent particularly misty refreshing natural scent use hair left smooth fluffy love shampoo product
124721,5,smell light mint use applied hair rousing flattery quality excellent size 355 my package shown picture package come squeeze bottle benefit strengthen moisture hair excellent formula help moisture hair recommend miles’s product good excellent people praise bought whole set use beginning
124721,5,quality excellent ingredient great quantity sufficient long period time mineral wonderful composition packing enough two month benefit taste normal symptom nutrition supplement treat deficiency
124721,5,thank suitable really liked want refuse size appropriate quantity appropriate thank herb thank indeed price appropriate want use taste bad
124721,5,also use shampoo part set hair little dry brittle manages stay place without problem scent also refreshing unpleasant recommend like heavy sweet scent texture heavy right
124721,5,amazing took whole set shampoo conditioned oil mask finished i'll go back get
124721,5,conditioned great hair use every two day moisturizing scent beautiful moisture meaning make hair greasy size fair quality good recommend product composition product brand great material
124721,5,wonderful beautiful easy use first time bought excellent size excellent packing composition applied scalp end
124721,5,i'm glad smell like came back salon even condition hair best conditioned purchased herb also moisturizes well
124721,5,like shampoo oil also bought conditioned hair mask! repeat again!
124721,5,never habit using conditioned age hair quality begin deteriorate dyeing hair cover gray hair lose hair start using conditioned tried immediately receiving natural comfortable fragrance smoothing effect hair also good significantly le hair fall blow drying purchased shampoo
124721,5,started using oil shampoo gentle green scent soothing size smaller typical japanese shampoo i'm worried cost performance i'll try using decide whether repeat seems good scalp hair i'd like continue using
124721,5,received yet ingredient taste usage size package quantity like
124721,5,curly thick hair get really friday unmanageable using hair dwyer using product hair feel firmer also like rosary mint scent use alternately treatment series
124721,5,light use refreshing scent rosary mint refreshing dry hair recommend using conditioned treatment
124721,5,scent best there's nothing else like also like keep curly hair smooth moisturized dry hair nice use two one bathroom one phone grm size right i'll definitely buying
124721,5,smell use quality size age packing benefit composition hair scalp mild’s product wonderful deserve due
124721,5,smell amazing easy use apply get hair 5 minute
124721,5,smell composition quality amazing size lifespan package sufficient last six month full size great need talk benefit beneficial result use 10 000 000% normal amazing term hair loss prevents dandruff scalp give amazing moisture smell amazing sensitive usage hair soft curled
124721,5,gentle cream like texture pleasant rosary scent washing hair smooth scent last next day think would good could provide nutrient scalp
124721,5,good composition prompted buy product quality good complaint cause extraneous reaction hair became softer easier comb le tangled use shampoo another company future order one simple use apply damp hair hold 5 10 minute rise smell mint rosary pleasant relaxing packing convenient hair soft moisturizing i'm satisfied order
124721,5,shampoo leaf scalp feeling refreshed conditioned leaf hair feeling moisturized smell great! natural gentle scent rosary mint refreshed mind scalp pore feel refreshed comfortable fall asleep much easier
124721,5,really wonderful product smell easy use quality excellent quantity plentiful advise lot benefit ingredient leaflet encourage read using product age appropriate quantity package included size excellent composition made natural material side effect preferable use gentle skin sensitive preferable consult specialist specialist doctor work improve skin effect diet adjust mineral deficiency body specific season taste excellent highly moisturizing skin especially winter season formula natural cause skin inflammation contains college help nail growth harm hair brown scalp material excellent recommended repeat product smiling face heart blue heart cherry blossom smiling face heart eye please support liking commenting thank check mark button folded hand light skin tone
124721,5,1 cook simple quick meal slow cooper use useful household appliance save time energy number calorie diet often want cook tired work order food home go restaurant well learn cook fast food many simple taste recipe need mix ingredient put pan 2 apply sunscreen skin every day skin age much slowly 3 simply cannot without fast food time time order children's set small portion full feel guilty calorie eaten 4 rule two bite want eat something harmful use rule two bite take glass cold water take bite choice drink glass water wait 1 2 minute take second bite 5 sure diet properly balanced high quality multivitamin complex cheapest way insure health 6 10 squat 10 push up every morning later increase load thus wake much faster
124721,5,previously purchased shampoo trial first scent seemed grassy get used using started smell really good got hooked feel good use far problem hair
124721,5,scent faint gentle scent seemed good body able shampoo without squeaky gathered well! used conditioned afterwards made hair smooth! shampoo refugee i'm happy found shampoo!
124721,5,conditioned curly hair liked good applied shampoo like good softens
124721,5,rosary mint scent mellow much rise well without leaving hair dry great quality hair love size price amazing well
124721,5,good product large size good packing good hair thickness
124721,5,wish like reading review soon product arrived used month trying said would give honest review without compliment course even sister asked size normal size look picture price suitable loss hair soul recommend product yes advise buy especially hair fallen need care product free preservative suitable age suffered hair loss due protein treatment needed product help hair growth thank god product beneficial advise buy product anywhere except herb counterfeit product product defect wish would make box bigger order much time put hair tip buy set shampoo oil hair mask enjoy thick hair beautiful smell don’t forget like beautiful people
124721,5,used past 2 month shampoo scalp oil saying cream started notice new baby hair quality packing amazing size perfect love scent healthy moisturizer hair using
124721,5,amazing conditioned go vertical well shampoo mask brand it’s easy use comb hair give hair glow moisture scalp wasn’t oily using scent another world always get compliment size great last 2 month shower 3 day per week package cut highly recommended
124721,5,intermediary tried product hope ingredient quality packing beneficial customer received like may god bless
124721,5,running conditioned ordered use alone based review short bob hair use 2 teaspoon wash body applying rise shower hair soft smooth touch run current bitten shampoo i'd like use line scent gentle verbal scent slight lingering scent smell nice
124721,5,thick coarse hair use conditioned i'm surprised hair soft next morning i'm lazy dry hair going bed never get stiff strange feel benefit conditioned treatment series recommend
124721,5,smell sweet easy use high quality large package size gentle scalp highly moisturizing
124721,5,love essence it’s moisturizing give glass glow look skin didn’t acne begin don’t know help love job brightening skin quality really good easy use size good package good gentle skin
124721,5,course need introduction beneficial hair scalp smell mint use 2 3 time week quality excellent size appropriate enough month benefit guaranteed excellent composition packing tightly sealed age expect adult honestly don’t forget like red heart folded hand medium light skin tone
124721,5,plan make house tomorrow night dinner six want come watch
124721,5,complete ingredient normal taste excellent quantity easy use package useful dietary supplement
124721,5,ingredient size quality good also many benefit
124721,5,praise people beautiful ingredient sweet smell normal fragrance good
124721,5,firstly want express appreciation quality effectiveness product using strengthening conditioned past month made noticeable difference health strength hair rosary mint blend scent refreshing invigorating creating pleasant experience use conditioned rich creamy texture making easy distribute hair leaf hair feeling incredibly soft smooth nourished also noticed decrease hair leakage improvement overall hair health since incorporating product hair care routine additional appreciate use natural ingredient product give peace mind knowing using conditioned free harsh chemical harmful addition conclusion extremely satisfied strengthening conditioned rosary mint blend become staple hair care routine highly recommend others seeking nourishing invigorating conditioned thank creating fantastic product considering customer feedback p
124721,5,strong smell large size easy use good quality preferable use scalp
124721,5,mmmmmmmm miss advise everything bitter sweet advise sweet
124721,5,best use entire group least month result appear
124721,5,peace upon hope customer like buy
124721,5,wonderful good size good quality highly recommended nice package
124721,5,good size scent hair best quality hair moisture
124721,5,swear amazing regret trying smell nice loose hair give softness loved swear
124721,5,effective order full package company oil shampoo conditioned alone normal bottle
124721,5,smell beautiful easy use shampoo make hair soft easy
124721,5,beautiful refreshing scent use shampoo put scalp hair size large packing excellent easy use leave sensitivity moisturizing immediately noticeable
124721,5,smell good use every 3 day great quality work best shampoo
124721,5,decent conditioned rather thick texture quite like smell
124721,5,consider one best product used hair
124721,5,hair strengthening conditioned contains mixture rosary mint
124721,5,scent mashallah use shampoo quality good
124721,5,felt hair dry know even though idea high
124721,5,good quality good ingredient nice package like much recommended era family
124721,5,great one recommend use keep try
124721,5,smell exactly like shampoo use always use nice conditioned make hair get tangled
124721,5,scent amazing rosary mint course lover scent use hair water experience use scalp give strong hydration formula without silicone harmful substance benefit eliminates split end size package large quality excellent age even hair sensitive preferable use entire package result stronger stronger
124721,5,took conditioned shampoo oil smell sweet refreshing fact whole set refreshing mint rosary period hair scalp become sensitive reduced use package large take time method put hair shampoo reach root leave five minute wash give nice moisturization hair period can't bear anything collapse
124721,5,excellent conditioned make hair pleasant touch good smell
124721,5,good fragrance good use best quality correct size age good packing benefit composition hair type good sensitive scalp moisturizes well
124721,5,helpful product high quality first use seems affect perfectly recommended
124721,5,quality great quantity good packing great benefit excellent ingredient good composition acceptable deficiency symptom repetition taste good good supplement good mineral searched elegance found searched quality good smiling face sunglass searched brilliance store smiling face smiling eye searched literature employee successful smiling face heart eye many competitor heart ribbon remain special one heart ribbon good tempt eye heart ribbon price crazy heart ribbon color dead color heart ribbon confused every customer heart ribbon
124721,5,usage hair density large size excellent quality benefit moisturizing scalp density
124721,5,good product good amount like company
124721,5,good product highly recommended buy herb
124721,5,scent nice size big enough great hair
124721,5,way could wanted could come pick
124721,5,nice smell use moisturizing hair high quality size good suitable adult good packing benefit moisturizing hair texture liquid
124721,5,scent feel make perfect summer make scalp sticky leaf hair smooth short hair size seems like last long time
124721,5,girl took compliment tried yet smell sweet considered strong bitter
124721,5,scent care quality size refreshed packing benefit formula routine relaxes feel
124721,5,ingredient natural fragrance fresh washed clean without using lot water feel like hair fallen le using
124721,5,strengthening ball strengthening ball strengthening ball strengthening ball strengthening ball strengthening ball strengthening ball strengthening ball strengthening ball strengthening ball strengthening ball strengthening ball strengthening ball strengthening ball strengthening ball strengthening ball strengthening ball strengthening ball strengthening ball strengthening ball strengthening ball strengthening ball strengthening ball strengthening ball
124721,5,gave gift said smell good take good care hair
124721,5,best hair growth experience sister experience
124721,5,now crazy recommend never dry thumb thumb thumb thumb thumb thumb thumb thumb thumb thumb woooooooow exactly thumb
124721,5,second time tried worth repeating recommend improved lot using
124721,5,experimenting hope useful liked speed delivery packing
124721,5,smell present use good quality high size excellent composition age packing medium nice
124721,5,now life changing feel straight hair feel oily shower
124721,5,wonderful product tightly sealed package shipped worth trying give hair silk feel
124721,5,sweet tried size quite good
124721,5,suitable size small package arrived adjusted closed protected good quality
124721,5,leaf refreshing effect scalp smoothed hair really good
124721,5,smell beautiful use hair high quality large size adult large packing high benefit strengthens scalp increase hair hydration
124721,5,benefit dangling hair excellent formula size excellent quality excellent packing smell nice use showering
124721,5,mille favourite got new baby hair may hair become stronger straighter highly recommended entire package quality amazing smell really good size good really helped scalp become cleaner and really good moisturiser sensitive hair lot use really easy clot benefit hair
124721,5,great conditioned really like also recommend ordering shampoo
124721,5,amazing leaf hair silk smell sweet use showering rinsing high quality
124721,5,honestly liked lot saw praise took basis size price suitable nice ingredient advise buy regret take pleasezzzzzzzzzzzzzzzzzzzzzz rating help give like thumb thumb
124721,5,great conditioned using combination shampoo mille
124721,5,conditioned quite good hair dry eye use shampoo moisture hair
124721,5,swear 5 year afraid change shampoo honey regret never
124721,5,product sweet smell used conditioned shampoo quality high applied scalp end give high moisturization
124721,5,beautiful refreshing scent package size large give moisture hair comfortable use
124721,5,excellent conditioned strengthening hair give softness strengthens hair get rid hair loss size package sufficient long period
124721,5,beautiful scent easy use high quality excellent size suitable age economical packing benefit strong moisturizer hair ideal formula nourishing scalp hair contains high amount moisturizing cause gallery
124721,5,useful girl nothing better herb product recommend red heart
124721,5,thank using two week felt nice scent recommend quality excellent size good used child five year old older package well package benefit oil great special formula help moisture nourish skin aromatic oil present nothing feel liked moisturizing smell present ingredient excellent
124721,5,quality great ingredient harmful use easy size appropriate packing beautiful quantity appropriate smell beautiful ingredient good size appropriate please give like earn point work comment read help earning point increase chance winning thank much everyone forced mind like make sure product suitable people suitable others careful choice read product ingredient carefully
124721,5,so good use twice week make hair wealthier smoother also smell nice bitten witch amazing hair
124721,5,like smell and quality good package also amazing
124721,5,i'm talking second use smell acceptable verbal smell acceptable difference feeling hair loss le fritz subsided
124721,5,experience oil bath product mile company wonderful
124721,5,make or hair smell good healthy shiny soft use shampoo
124721,5,took lot praise smell amazing use three time week quality amazing liked product lengthen hair thickens hair scalp moisturizes effectively
124721,5,beautiful wonderful worth trying herb product original worth trying don’t miss green heart green heart green heart green heart green heart green heart green heart green heart green heart green heart green heart green heart green heart green heart green heart
124721,5,product nice flavor excellent improvement appears quickly smell acceptable use easy
124721,5,use coach hair feel great believe it’s com friendly still waiting see help harmony related hair loss
124721,5,heard lot good amazing thing hope expected
124721,5,best thing herb high quality nice package big size
124721,5,wonderful excellent recommend high moisturizing power useful winter sometimes
124721,5,bought product based people's review never disappointed
124721,5,leaf hair smelling fresh scalp refreshed
124721,5,honestly using month really saw difference hair thickness really recommend
124721,5,smell really good! high quality give good moisture hair remains really soft pleasant afterwards packing convenient use
124721,5,using together oil two month notice improvement conditioned good texture verbal smell
124721,5,good using week feel le hair loss
124721,5,benefit immediate size medium high quality easy use help moisture hair protect falling
124721,5,current session new conditioned keep hair soft full life first purchase see difference wish
124721,5,strengthening shampoo also improve condition hair due fact skin dry le retains elasticity susceptible itching hair restoration active component fill unevenness article add softness heat resistance increase elasticity start reconstruction process gentle cleansing
124721,5,conditioned effectively strengthens moisturizes hair leaving soft manageable free leakage
124721,5,like smell amazing waiting work
124721,5,dry hair work great shampoo give volume husband like smell sensitive scalp chemical scent bother doesn’t either
124721,5,good quality hair growth useful nice verbal scent nice size last long good packing doesn’t spill
124721,5,great scent amazing quality perfect size perfect age
124721,5,cool hair conditioned high quality composition easy use moisturizing effect use entire line company
124721,5,wonderful rich nourishing moisturizing conditioned hair give shine hydration hair
124721,5,liked loved order quantity package full size suitable old people quality recommend using 3 time twice day smell okay
124721,5,amazing honestly really liked growing heart growing heart growing heart heart arrow heart arrow heart arrow heart arrow heart arrow highly recommend true true fantastic growing heart
124721,5,hair conditioned really softens hair leaving enriched moisture hair nearer friday use pleasant smell heavy great product definitely order
124721,5,ball acceptable scent daily use moisturizes dangles quality excellent size packing amazing
124721,5,great scent make hair really smooth hydrate gentle scalp quality really good
124721,5,trial size large use end hair smell light resembles smell fresh mint
124721,5,work amazing shampoo dont grease hair scalp
124721,5,smell somewhat strong similar herb called nasi use washing face lotion well apply scrub face wet rub lightly circular motion face dry wash moisture face well quality excellent size medium enough month age one month two month benefit freshness lightning removing dandruff black color repeated repeat course high moisturizing use nice recommend benefit comment forget like don’t know like see everyone like writer give like let know happen
124721,5,use conditioned shampoo brand would recommend light gentle hair sweet smell size packing composition excellent course benefit rosary well known cause gallery moisturizing excellent put scalp hair underneath
124721,5,gentle soft smoothed hair shampoo supplement protects hair loss daily use
124721,5,great product make hair soft nice third order also use conditioned
124721,5,give wonderful feeling overlapping seems therapeutic side also active
124721,5,hair improved sensitivity good quality
124721,5,bought conditioned mille strengthening shampoo good sensitive hair
124721,5,great size ingredient good serving size great!
124721,5,took right shampoo conditioned honest awesome first time i've taken smell good
124721,5,high quality product useful protect skin barrier size generous u want see result use frequently
124721,5,awesome without it? moisturizes hair amazingly leaf hair refreshing healthy love smell little strong people may accept
124721,5,smell usage quality size age package benefit winter formula smooth texture moisturizing delicate taste ingredient eat
124721,5,wonderful material repeated experience easy use high quality wonderful size excellent packing smiling face
124721,5,light conditioned leaf hair feeling smooth drying like smell i'd like try mask i'd happy could help friday hair get little better
124721,5,rosary mint tonic ball smell pleasant soft use shampoo apply hair wash hair leaving minute hair cause gallery side effect leaving hair soft moisturized strengthens scalp work significantly moisture hair preferable use rosary shampoo
124721,5,good excellent quality wonderful excellent quantity acceptable smell good size
124721,5,amazing smell well package yet see effect long term far great would recommend friend use consistency great definitely try buy future see full effect scent nice good
124721,5,size quality use smell quality nice excellent
124721,5,excellent shampoo! took recommendation really liked it! order
124721,5,arrived quickly! used yet work i'd like buy
124721,5,excellent dry hair hair type help moisture curly hair prevent split end
124721,5,soft rosary scent leaf hair feeling light smooth benefit sensitive scalp size quantity definitely worth easy use pretty packing
124721,5,hair become long shiny smell nice
124721,5,good quality ingredient big size easy eat swallow colic acid give energy effect niacin flush good packing potent nervous system metabolism really good taste mineral benefit composition deficiency supplement symptom frequency scent use age
124721,5,better shampoo misty scent hydrating suggest use mosque line product wash hair 2 day week amazing shampoo sure clean hair size good way
