product_id,rating,review_text
110487,5,really like it!!! i’ve huge change hair volume baby hair size surprisingly last longer expect doesn’t strong scent others use shower prevent making scalp sensitive
110487,5,scent use quality size age package benefit composition hair scalp sensitive moisturizer amazing really amazing like product it’s making hair soft good love strong smell bow shampoo twice get smell i’m love product buy red heart
110487,5,using since nov 2023 along strengthening shampoo mint scent good say effective hair strengthening growth cool scalp feeling really relaxing use 2 3 time week definitely order another bottle
110487,5,size package scent amazingly beautiful i’m using frequently concern hair works! it’s gentle sensitive skin composition made especially benefit great quality also great it’s perfect 30 age totally recommend it!
110487,5,friend using scalp hair strengthening oil rosary mint delighted result refreshing rosary mint scent invigorating oil significantly improved health scalp hair she’s noticed le leakage shine since incorporating routine oil lightweight non greasy making easy apply massage scalp product perfect anyone looking strengthen hair maintain healthy scalp
110487,5,best forever product overall result study provided evidence rosary oil may effective certain hair growth moisture hair sensitive well scalp composition benefit package amazing age wonderful size perfect quality high quality use every week scent
110487,5,seems good enough prefer mixing carrier oil work good nd keep using see whether make difference hair thickness scent mild overall seems really good purchase size also good price good quality
110487,5,i’ve using mille rosary mint shampoo conditioned mask deep conditioned week now! wish would taken picture really help assist care hair experienced hair loss harmony meditation change helped getting back growth! strong genet come hair follow healthy diet vitamin well could also assist still love product! 10 10
110487,5,hair oil fantastic i’ve found good scalp hair apply clean hair put but leave either till wash night next day contains good quality ingredient many us benefit soothe treat scalp hair noticed hair grows lot faster use regularly love package glass dropped ease application love scent always smell peppermint always lift mood it’s like sea treatment it’s moisturising
110487,5,great oil give using month it’s excellent scalp oil helped itchy scalp dedicated shampoo didn’t use shampoo brand it’s natural kind scalp tolerated great hair boost grow
110487,5,lot dandruff product really helped useful dry time oily scalp also good natural scent really liked product used dry wet hair really good quality
110487,5,use month one week middle see hair fall stopping good like hair fall like use product keep going use product update review month something like
110487,5,advise buy it’s smooth heavy skin scent smell care quality size package benefit composition routine personal feel frequency’s wrote submit review it’s really good product buy that’s think
110487,5,scent use quality size age package benefit composition hair scalp sensitive moisture use scalp leave 1 2 hour wash using 3 week saw little difference lot baby hair keep using like definitely buy finished like thumb light skin tone
110487,5,struggle genetic hair loss hair thinning fine thin curly hair second bottle st noticed huge difference make scalp smooth even thought oily hair feel coarse baby hair crazy look electrocuted hata usage one twice week last 3 4 month
110487,5,used first time already saw change i’m definitely going keep using buy love scent good quality size good enough pot price age 24 it’s good package comfortable came box great benefit amazing composition hair scalp already got better think it’s ok sensitive skin hair it’s also moisturizing
110487,5,love size use week hair grows fast recommend always use buy it’s stay long thine long age use package good lot benefit
110487,5,loved product use twice week scent bit strong like actually feel rosary quality really nice benefit scalp moisturized hair well size product bad way package make use easier
110487,5,suffering hair loss issue since started working middle east lucky come across video mille oil since recently bought started using noticed hair loss reduced soothing scent easy apply
110487,5,love actually someone dry scalp feel product really helped itchiness also also make hair feel super soft also double wash hair long thick perfect want start pre wash boiling routine! still wash hair every day good scent
110487,5,scent pleasant easy use size good last long time quality product top good hair apply scalp plus sensitive scalp worker well
110487,5,bought hair oil seeing lot recommendation thin wavy long hair suffer knot hair loss looking scalp hair oil apply order strengthen hair using twice week shower letting stay scalp hair around 1 2 hour washing several week using notice change hair le oily day 2 3 washing hair le tangled
110487,5,useful u product amazing thanks lip taste herb red heart red heart red heart red heart red heart red heart red heart red heart red heart red heart red heart red heart red heart red heart red heart make training better quality excellent ingredient excellent taste size excellent packing age 14 good flavor age 14 frequency timenot sensitive gentle use moisture
110487,5,good size got yesterday used immediately strong oil thick used see difference hair shiny soft advice buy i'm sure buy
110487,5,i’ve many baby hair grow using product lot bald spot head filled hair feel nourished healthy product definitely worth hope bottle size perfect quality application amazing
110487,5,used one bottle purchasing second hair got stronger new baby hair growing size package nice moisturizes scalp quality great that in purchasing scent nice benefit great sensitive scalp
110487,5,oil great oil grow hair really good use two day per week make scalp fresh really smell good quality perfect size perfect sensitive skin really like moisturized hair scalp
110487,5,used 2 month 2 per week nice scent mint guess it’s suitable wide age range size bottle enough about 3 4 month package easy use store didn’t made scalp pitch anything like hair length used almond oil high quality product definitely recommend
110487,5,scent rosary mint used use shower moisturized hair next shower stop hair loss texture soft oily put scalp size big quality high packing satisfying suite sensitive hair scalp
110487,5,used couple time result see second time use smell strong use twice week quality size bottle last two month benefit oil extreme
110487,5,used around month half already feel difference make new order planning order one piece see better result concentrate mostly forehead part fuller hair look baby hair growing
110487,5,friend recommended use it’s high quality hair size good packing nice scent nice like encourage scalp massage healthy baby hair
110487,5,honestly big fan product using two month seems good far put hair two hour see result recommended hair use mask hair mile use shampoo
110487,5,lovely oil want grow hair take care scalp scent rosary love use oil washing hair applying scalp q bit length leave 1 2 hour wash shampoo great quality unfordable price
110487,5,quality amazing size perfect enough benefit hair got long short time use 2 time week scent like mint sensitive like water moisturizes hair much packing good age 12 month
110487,5,best smell bad either performance make rich blend moisturizing ingredient conditioned effectively nourished hydrate hair leaving feeling soft manageable despite lackluster scent conditioned get job done making reliable choice need moisture hydration hair overall prioritize performance fragrance conditioned worth considering moisturizing benefit
110487,5,using couple week already see difference scent mild quality pretty good continue using think great like made hair look fuller packing easy use
110487,5,second order use twice week shower scent hair look front doesn’t cause sensitivity moisture scalp size proper 2 month use twice week package quality perfect see benefit result within one month use
110487,5,scent bit strong bad easy use come good size good packing good quality give seen great benefit hair scalp moisturizing in by age dont sensitive scalp composition suitable
110487,5,using product see quality best it’s best moisturizer ever used use sensitive skin make look better lot benefit packing nice well really enjoy using red heart red heart red heart
110487,5,really liked soap age guess it’s size good great packing benefit make skin smoother wealthier make sure put body lotion using make skin dry shower product it’s good worthy also smell good quality great scent feel great thank you folded hand medium skin tone folded hand medium skin tone folded hand medium skin tone folded hand medium skin tone end growth baby curl fritz
110487,5,it’s good benefit hair much thicker baby hair growing faster applying scalp smell bit strong got used dont apply u wound scalp may hurt scalp sensitive wound i’m second bottle
110487,5,mille rosary mint scalp hair strengthening oil luxurious treat scalp hair someone value natural ingredient effective result product become staple hair care routine scent delightful product great simple use
110487,5,really like soon good sure recorder really like good help skin much size good good quality like packing alone smell good
110487,5,love product much good ingredient quality smell package good size take one capsule three time day good benefit good taste improve nail buy advise buy improve skin hair hair become healthy
110487,5,peppermint scent easy use quality texture good helping hair growth type even sensitive scalp great composition used season safe age package amazing may cause drying hair moisturizer scalp bigger size highly recommended scalp hair benefit amazing product highly recommended
110487,5,sister love use day day quality like smooth size good age 21 benefit grow little hair sleep scalp it’s sensitive like
110487,5,suffer dry scalp damaged hair year saying color treatment originally bought product get ahead start postpartum hair loss i’ll deliver baby april one use noticed much cleaner scalp softer hair hoping help hair growth too! also massaged scalp put oil length hair end lazy wash recommended time braided hair left little day make hair oily washing love result gave
110487,5,hair oil amazing use everyday scalp moisture dry hair grow edge it’s working great scent bit strong tolerable size tiny package super cut love come dipped
110487,5,one high point oil distributed easily hair scalp don’t need large amount trick there’s light singly coolness come scalp pretty calming shampooing
110487,5,would say bought seeing many feel wasn’t expecting quick result honestly surprised moisturises scalp unlike others like rosary’s scent great quality using one month easily say it’s best would recommend bigger size please! benefit include hair growth hair health
110487,5,recommend product it’s work perfectly looking hair use one week see difference hair scalp specially sensitive scalp itchy use product mille help moisture hair scalp also size doyle good compared price
110487,5,it’s amazing result visible quality packing good it’s beneficial hair growth help maintain healthy scalp nutrient help lot hair growth use thrice week scent good anyone experience hair fall use age doesn’t matter
110487,5,it’s unbelievable worked hair!! oil worked like magic scalp increased baby hair stopped hair loss gave thicker fuller hair appearance one month only!! i’m really happy result sure order continue using
110487,5,really love oil benefit oil great oil contains mint rosary scent good use dry hair message hair left 2 hour take shower satisfied way package come safely
110487,5,using month used oil scalp week use two time week smell like vex know misty scent love scalp feel great moisturized using noticed baby hair use hair treatment moment derma roll scalp using better result keep three hour package great love proper thing long precise size also great like said used month twice week finished half bottle hair dry scalp dry sensitive low normal pomposity hair wavy hair type time use month half
110487,5,bought product first time seeing social medium size package perfect indoors travelling it’s big product’s scent nice strong rosary smell since use little amount it’s nice
110487,5,i’ve using hair oil year oil best one! noticed le hair fall much baby hair quality amazing good scent rosary like everything scalp hair oil also like bottle self comfortable use
110487,5,first time buy try read lot review good try good small size bought another one age type hair bought easy use good package little bit scent
110487,5,good scent easy use bottle size good butbsmall quality packing perfect benefit unlimited help recover save hair moisturizes hair perfectly essaying scalp composition help hair grow hopefully help save hair regardless age
110487,5,scent good use 3 time week quality good size good suit age package good benefit clot use it hair scalp sensitive dont use moisture hair
110487,5,love scent! subtle rosary scent it’s hope decided give try fact excited try scalp hair thin life eversince started hair boiling using oil hair growing healthy believe oil work wonder update!
110487,5,easy purchase great product line reasonable competitive price always pleasure order store way easily save 10% first order copy paste promo code alo065 checkout also get 10% credit total 20% free u shipping $20 sometimes free international shipping depending item order additional plenty daily weekly promotion special page check well overall highly recommend herb everyone!
110487,5,good hear thanks one lot money way get good time little late way back home work going process popular good way come get better idea need know going product image item going process
110487,5,best hair oil ever good scalp good sensitive hair make hair look moisturized soft heart suit lot benefit oil size good one month !! use week 2 hour wash or hair bad scent recommend
110487,5,indulge mille's strengthening hair mosque rosary mint herb formulated nourish fortify hair treat lock experience invigorating scent rosary mint deeply conditioning strand improved strength vitality say hello wealthier resident hair!
110487,5,scent strong like small size product use pretty frequently also came packing although feel pretty good product combined many oil good hair scalp health recommended frequent use
110487,5,scent easy use right quality perfect size benefit using amazing came well sealed package hair healthy scalp wealthier hair filled baby hair using one month true magic
110487,5,well package good quality medium size enjoyable use hair benefit composition felt soft cooling effect moisture scalp l prevents dandruff encourages hair growth there growing little hair scalp day use feel itchy nice scent good age sensitive skin must haired hair shampoo mask brand
110487,5,love size quality package easy use job price home house best option start new home start looking best option think biggest challenge good price quality good job right price price house price scent
110487,5,love product rosary mint smell satisfying feel good scalp use scalp pre wash massage leave hour also use throughout entire length hair sometimes double washing hair scalp feel clean fresh like really got deep cleanse find really help remove minor dandruff product build know i've using long enough notice stronger longer hair result feel like i'm already noticing result hair never felt thick healthy
110487,5,i’ve tried dozen scalp oil without doubt one best help moisture increase hair growth sensitive scalp hasn’t gathered actually use itchy scalp i’m issue put scalp right shower brush hair bit greasy use pre scalp oil prior showering try let quality liquid gold sit scalp long possible! smell pleasant putting
110487,5,hair damaged hair oil added life shine like product quality scent really pleasant really like rosary oil liked oil smooth pleasant hair month really lengthen hair
110487,5,scent good used many month result amazing baby hair noticeable especially front good quality size enough long time moisturizing good sensitive scalp used adult age packing excellent always
110487,5,scent scalp oil strong yet bad actually get great amount high quality product really good price packing simple use without problem size good price something know product scalp end
110487,5,read watched lot review product used know love always stock massage scalp use oil oil help strengthen hair grow baby hair mint rosary strong scent quality size packing great red heart red heart
110487,5,oil wonderful i've using 2 week already twice week result visible hair fall much anymore rather strong scent especially mint love great quality size fine scalp feel hydrate
110487,5,far since 2 year really love pink heart pink heart pink heart pink heart pink heart pink heart pink heart pink heart pink heart pink heart pink heart pink heart pink heart pink heart pink heart pink heart pink heart pink heart pink heart pink heart pink heart pink heart pink heart pink heart pink heart pink heart pink heart pink heart pink heart pink heart pink heart good skin big size well packing perfect best routine feel comfortable personally amazing quality smell nice scent care benefit composition frequency use sensitive skin gentle age concern
110487,5,oil good would recommend nourishing feeling scalp revived hair created sensation like breathing root would recommend people bolding weak scalp dont use directly rub or hand gently massage onto hair scent good size oil would last two month oil or hair daily basis every two day definitely recommend
110487,5,love much!!!!! good!!! red heart red heart red heart red heart red heart red heart red heart red heart red heart red heart red heart red heart red heart red heart red heart red heart red heart red heart red heart red heart red heart red heart red heart red heart red heart quality size age package ing benefit composition season moisture texture sensitive good sweet use scent
110487,5,dont like scent lot benefit package good wont broke little amount hair birth used mosque mille felt better serum get wealthier hair lot review read quality also good
110487,5,i've read heard many thing oil i'm second bottle already noticed baby hair growing hair getting longer like smell strong rosary smell keep using see change hair length
110487,5,heard lot hair oil used one time continue cone add another review quality good scent perfect use easy ingredient good size perfect make hair smooth good sensitive scalp moisture hair perfectly
110487,5,need really small amount time size quite big product last long time convenient use apply doesn’t irritate scalp convenient leave entire night well however change pillowcase prevent acne scent strong unpleasant taste i’ve using 2 week applying preach several hour overnight i’m sure yet it’s beneficial hair growth i’ll back update
110487,5,second purchase oil number one put scalp three hour washing hair scent amazing see benefit hair much better shine quality improved would recommend anyone want improve hair care routine
110487,5,used several week apply scalp every wash day leave hour washing hair look shining wealthier pleasant scent definitely high quality product lot natural oil that's bought feel moisturizes scalp
110487,5,normally i'm skeptically social medium endorsement product truly impressed struggling scalp issue month applied overnight provided soothing relief additional noticeably softened hair made dangling brushing much easier washing despite usually feeling caseated mint scent one bother
110487,5,best product ever used hair thin hair whole life using 3 month lot baby hair helped strengthen lengthen hair love scent really fresh nice great quality packing size get lot product use scalp massage stimulate hair growth faster love it!!
110487,5,package came packed safely size product perfect using approximately 2 month hair started thicker itchiness scalp got reduced see change using full pack shampoo mask oil use oil clean hair scalp result worth hope amount baby hair get incredible
110487,5,best hair product give ever used put 1 2 hour wash hair scalp hair hair feel much healthy shiny since started using able wash hair week without becoming oily amazing
110487,5,i've using scalp hair strengthening oil rosary mint several week become game change hair care routine right first application noticed immediate soothing sensation scalp thanks refreshing blend rosary mint oil lightweight making easy massage scalp without leaving greasy residue promote wealthier scalp i've also noticed reduced hair fall increased volume hair strand natural ingredient especially rosary mint provide calming aroma finger throughout day creating sea like experience
110487,5,second rosary oil bought difference! rosary oil nearly good one recommend oil company try use every two week scalp really think help grow hair hair grew much one ear size totally worth price take finish use little time strong rosary scent personally like there's nothing really still 100% recommend helped please forget like heart hand light skin tone
110487,5,scent rosary mint use hair leave 30 minute twice week shower soothe scalp moisturizes hair keeping shiny healthy work sensitive scalp quality amazing size ok packing cut suitable every age
110487,5,mile scalp hair strengthening oil nourishing delight quality ingredient invigorating rosary mint scent make standout sleek packing add appeal beyond pleasant aroma moisturizing benefit scalp hair remarkable must anyone seeking top quality hair oil delightful package
110487,5,heard lot rosary oil decided give try it’s strong hair oil didn’t leave scalp 15 20mins using hair start fall suppose exact opposite thing guess working sensitive scalp?! quantity size look small need small amount cover scalp
110487,5,overall i'm quite satisfied experience ordering process simple delivery faster expected product arrived well package perfect condition match description provided online quality good better anticipated i’ve using work advertised overall i’d definitely recommend it!
110487,5,love product! using week 6 month find made huge difference scalp health combination skin find original formula light enough little go long way use sparingly want shiny healthy hair look further!
110487,5,love oil ! size good for price packing fine like application almost doesn’t scent little rosary smell using maybe th bottle benefit help hair grow faster stick routine scalp okay rosary oil don’t apply length scalp managing seeing difference using hair massage must work great together! recommending oil friend want grow hair faster
110487,5,i've using oil scalp hair 1 x weekly almost year incredibly effective helping hair region following significant hair loss due illness massage scalp hair leave couple hour washing smell lovely fresh
110487,5,bottle many benefit package came good condition size last 3 month high quality oil receding hair line put oil bald spot scalp part need work wash hour smell could sensitive people
110487,5,really recommend or looking hair lot sparkle u may like scent in one smell misty slightly smiling face u want grow or hair back bring quality size packing great i've using 8 month know really loved red heart red heart red heart
110487,5,i'm absolutely loving hair product review commented greasy i'm problem add drop two routine night leave day scalp feel great i'll update long term result future
110487,5,scent great use easy product high quality size bit small price use age packing okay protective wa many benefit hair follicle scalp composition good sensitive skin doesn’t moisturizer
110487,5,third bottle love using oil mixed rosary oil organic coronet oil smell oil calming size perfect come dropped make easy use packing great come glass bottle like doesn’t irritate scalp also help color treated hair
110487,5,satisfied quality oil rosary oil stimulate hair growth reduce dandruff improve scalp health rosary mint essential oil also increase blood circulation scalp lead thicker faster growing hair aroma rosary mint help feel awake cool refreshed also help focus concentrate clear mind one study found rosary aromatherapy significantly improved overall memory quality secondary memory factor
110487,5,i’ve using oil product hair growth believe complex helped make hair longer wealthier doesn’t irritate sensitive scalp good natural rosary scent package comfortable use overall it’s good composition highly recommend try
110487,5,excellent packing great value money! shipping quick although tried product yet believe good seems high quality love ingredient plan use hair consume well size generous making suitable skin i'm hoping aid hair growth even though first time trying looking forward great benefits!
110487,5,rosary mint oil work well nourish scalp feel cool sensation massage scalp oily recommend put massage scalp like 1 2 hour wash product fully absorbed
110487,5,use oil morning combine pure castor oil evening honestly noticed baby hair airline le hair loss washing head is wash hair mille shampoo know diminishing hair loss due oil shampoo
110487,5,oil good scent feel good hair scalp use make hair manageable moisturizes well last long time don’t need lot it’s foot sized bottle feel like high quality oil!
110487,5,thyreoid problem that’s hair thinning product work need consistent it’s good sensitive scalp moisture hair also like scent it’s misty put hair massage leave hour wash don’t leave overnight it’s worth buy i’m definitely buying
110487,5,scent lovely use frequently part hair care routine composition treat benefit scalp highly moisturizes hair whether it’s dry sensitive hair quality product hair wonder size package cut love it!
