product_id,rating,review_text
110487,5,now loved much color amazing quality looking powder nice i’ll definitely ordering scent nice size great loved much good packing packing loved coverage beautiful
110487,5,quality age knee taste effect package benefit diet quality age knee taste effect package benefit diet quality age knee taste effect package benefit diet quality age knee taste effect package benefit diet quality age knee taste effect package benefit diet quality age knee taste effect package benefit diet quality age knee taste effect package benefit diet quality age knee taste effect package benefit diet quality age knee taste effect package benefit diet quality age knee taste effect package benefit diet
110487,5,scent little strong tell it’s great quality used self age 19 help hair grow especially scalp it’s really good even sensitive scalp count really moisture it’s meant lot benefit hair growth time help keep away louse packing size great made glass
110487,5,using hair oil two week already satisfied result hair look better noticed le hair fall size good little go long way bottle last quite package good easy apply highly recommend
110487,5,rosary mint scalp hair oil amazing! refreshing scent feel soothing scalp using week i’ve noticed hair feel stronger le prone leakage it’s lightweight doesn’t leave greasy residue huge plus dropped make easy apply directly scalp highly recommend anyone looking boost hair strength improve scalp health!
110487,5,amazing daily use smell great quality good daily routine personally like using feel great size nice also packing like control oil face look matter finish amazing scent good composition
110487,5,rosary oil excellent quality fearing natural ingredient provide remarkable benefit hair nail package size perfect regular use i’ve noticed significant improvement hair’s moisture scalp health particularly age moisturizing property help enhance shine strength refreshing smell lovely bonus oil gentle enough sensitive skin making great addition nutrition beauty routine highly recommend rosary oil anyone looking devitalise hair promote healthy raging!
110487,5,mille scalp hair strengthening oil rosary mint 2 ll oz 59 my amazing product like increase hair health significantly scent fresh easy use like product natural quality high size good suitable age package nice benefit composition scalp sensitive moisture review submitted
110487,5,actually use like least 3 time feel regular scalp treatment show high effectiveness use deal hair loss like whole life seemed actually helped see much le hair loss showering brushing hair really glad gave try ordered sceptic first like let’s give shot” definitely don’t regret
110487,5,i'm recommending everyone know! smell good easy application everyone use size big last long time based much use hair scent pure rosary like good package quality good sensitive scalp benefit limit hair falling baby hair growth!
110487,5,"rubbed scalp time week see hair growth boasted new small hair coming warning make hair greasy tend put 2 3 hour in going shower look good! overnight also ok """
110487,5,great product help stimulate hair follicle length hair increased half centimetre
110487,5,nice hair serum effective seen good result baby hair start grow using product along hair vitamin satisfied result smell good
110487,5,product distinctive taste great recommend trying high quality
110487,5,nice product female good hair make strong nice looking
110487,4,oil good! first made hair fall scar stopped actually helped hair grow back love it! feel bit hot scalp usually apply 10 15 minute washing
110487,4,light hair like smell still early see improvement week i’ll patient wait hair get better used scalp root wait around 4 hour wash hair package perfectly sealed i’m happy purchase
110487,4,i've using rosary oil hair i've noticed hair growth though i'm entirely sure solely due product packing practical easy use composition seems effective appears stimulate hair growth however smell quite strong might overwhelming oil easy apply despite strong scent potential benefit promising might worth trying looking boost hair growth prepared strong aroma
110487,4,oil smell nice love misty hint easy apply importantly light weight! afraid it'd make root greasy
110487,4,it’s good scalp doesn’t smell bad anything use everyday it’s really good make hair thicker instead think hair size perfect actually keep like one two month probably use age benefit amazing make hair longer good hair oil thick hair perfect
110487,4,scent easy use small size good composition moisturizer soft texture season suitable sensitive skin high quality age good packing amazing benefit gentle skin frequently use concern help grew hair scalp scent easy use small size good composition moisturizer soft texture season suitable sensitive skin high quality age good packing amazing benefit gentle skin frequently use concern
110487,4,i’ve used product 2 week honestly scalp feel great hair shiny it’s greasy you’d think would leave hair greasy residue hope! honestly one best hair serum i’ve ever purchased
110487,4,easy use quality super scent size ok package good suitable age color smooth texture sensitivity concern using 5 month benefit amazing buy recommend light scalp harm hair moisture composition good
110487,4,even start one ?! benefit endless lower blood pressure protects heart improves cholestrol slightly support hair growth high quality fish oil pill look beautiful despite size extremely easy swallow considering smooth love package opera 3 well strong efficient
110487,4,misty scent average size compared price applied directly my scalp don’t think use go outside would recommend using shower leaf hair oily maybe best applicable write second review finish 2 bottle purchased
110487,4,good scent use shower 10 20 minute drop enough scalp wear plastic hat increase benefit product good quality rosary oil small size last long co u need drop felt hair moisture using soft came well package the lot
110487,4,can’t say sure whether result using oil since addition also used product bitten scrub mass massage lot new hair appeared composition safe suitable sensitive scalp mint smell pleasant refreshing size large last long time applied washing left 10 15 minute used shampoo hair care product
110487,4,good didn’t stick loudly cry face thing wanted use oil grow hair thickened since working fast food restaurant found hard go home put 20 30 minute shower didn’t time i’m tired cut shower already long curly hair cared washing go sleep took picture can’t tell see difference it’s like maybe little hair grown stopped using can’t blame it’s know use stick routine i’ll see result speaking 5 month getting first 3 work used week stopped loudly cry face get back using also smell weird ink wash it’ll go away
110487,4,first hair boiling experience first didn’t understand benefit get boiling give attempted hair boiling didn’t ended great understanding proper process step follow definitely see result even give inconsistent! size perfect dont need feeling oil scalp properly
110487,4,easy use nice scent smell seems good quality small size age le expensive package hope good benefit hair root sensitive moisture good good scalp think good composition hope offer soon small expensive
110487,4,mille rosary oil made hair feel refreshed wealthier use especially used conjunction shampoo conditioned leave conditioned see shiny hair turned every time look mirror sparkle sparkle also scent really refreshing leaf fluttering wind definitely donna order another bottle hundred point
110487,4,quality size packing composition great! it’s one best oil great benefit strong scent may suit sensitive skin it’s better dilute light oil doesn’t moisture hair try use or scalp showering suitable age
110487,4,first thing like product feeling give scalp fresh since bit warmth like scalp cleaned also used end hair now hair softer remember use end 10 minute oil even wash hair result growth still know benefit used 3 time till continue using keep anything new smiling face open hand yes concerning size bottle course wish bigger want use scalp nourishing end hair vanish faster using one purpose economic smiling face tear
110487,4,used month say made hair long faster however grow lot hair honestly use scalp massage heard make scalp dry see opposite moisture kind dry scalp size good used almost half month yeah that's benefit got
110487,4,super excited try product since hair damaged split end showering applied five drop hair found made hair oily end found bottle suggests three different way use however based experience would recommend using showering 30 minute advance even take opportunity scalp massage help product absorb better hop shower notice hair feel refreshed split end thing past give go see amazing transformation bring hair!
110487,4,would unfair give high rating enough time passed real effect say rosary oil pleasant applied like slightly cooling effect write full review see new hair le hair loss
110487,4,definitely smell like got rosary say purchased product claiming rosary actually doesn't! firstly! i've started using can't see whether helping hair yet tingling sensation applied make hair look bit oily
110487,4,heard hope surrounding hair fall product decided give try three week i'm left uncertain effectiveness package sleek dark glass bottle add touch elegance routine scent undeniably pleasant making use enjoyable however despite regular application i'm unable discern significant difference hair fall journey positive side irritate sensitive scalp plus size adequate expected noticeable result point overall decent product transformation solution hoped
110487,4,rosary oil hair put scalp perfect use every week scent good size packing quality good also isn’t first time used it’s benefit ink age sensitive someone
110487,4,i've using oil month can't exactly tell already beneficial hair however notice i've new growth recently can't tell bc oil scalp managing supplement i've taking smell good though
110487,4,quality product nice packing good size husband applies daily scalp beard use well scalp well grow noticeably hair reduce amount fallen hair scent pleasant use massage leave hour wash hair per usual leaf scalp feeling moisturized
110487,4,used good result felt burn like effect hair quality good contain good ingredient hair size enough two month benefit started taking care hair recommended sensitive scalp strong mint scent
110487,4,first time using concentrated one used oily scalp oil don’t work make break one much nicer wouldn’t recommend using every two week
110487,4,started using 2 month ago use week since don’t like oil hair except day give scalp tingling sensation believe due peppermint sure i’m reacting anything since ingredient bad people strengthen hair observe le rainfall using also see hair growth think would work better frequent usage
110487,4,see massive change hair within month worth scent great far quality one best oil i've used i'm still going bottle though lasting age postage packing really good
110487,4,good quality rosary oil anyone want strengthen hair improve luster use week leave overnight leaf hair soft scalp clean purchased amazon first time bought second time le expensive herb
110487,4,bought benefit sensitive scalp hair read lot good review it’s quality composition moisture raging hair use week really like scent size nice really hope long term help prevent hair fall nice packing also
110487,4,helpful day feel scalp flogged itchy i’ll apply viscous oil scalp let sit 20mins using mille shampoo twice wash gun well relieving pitch helping hair feel healthy airy again~
110487,3,scalp pretty sensitive tried using several time every time tried scalp started pitch burn guess maybe allergic certain ingredient it’s sensitive scalp strong smell personally didn’t like read lot good review guess good
110487,3,nothing special oil opinion bought hope already tried oil actually making hairgrowth potent coming cheaper probably better quality see one average worth hope money also light personal added drop essential oil make potent taking count adjusted used base oil good buy way price bought bottle organic oil added essential oil provide hairgrowth also can't say much benefit hairgrowth i'm using many product different oil well one adjusted sometimes given reason would probably buying
110487,3,high hope mille rosary mint product hearing much hope unfortunately live expectation used diligently hoping noticeable effect sadly experience significant difference hair health scalp condition
110487,3,size age package quality use scent benefit composition moisture hair scalp sensitive give white hair afraid using honestly better using both gelatin supplement hair well rosary water moisture barrier conditioned smell nice need
110487,3,grows hair haven seen massive change span couple month using interesting scent loved packing felt scalp feel like quality product doesn benefit hair type much
110487,3,alright listen carefully truly effective please stay away brand shampoo moisture scalp help growing new hair use correctly scent decent size enhanced th overall quality decent
110487,3,product foe hair scalp used couple time think scalp sensitive used small drop area think need moisture scent strong size good trying first time give try overall don’t think good everyone claim
110487,3,might overhyped use scalp every time wash hair whole waiting hour ritual hasn’t transformed hair cut product though find cheaper one get rosary oil
110487,3,used hair start falling gave another chance mixed castor oil still feel hair falling decided stop using think made hair type fine wavy scent misty
110487,3,previously used castor oil mixed rosary oil working snapped convenience ensure potent liquid quite thin thick like castor oil take lot cover chink scalp dont think purchase
110487,3,good moisturizing hair showering didn’t notice improvement yet related hair loss thickness probably need use long time solid opinion general keep using twice weekly shower hope see good result
110487,3,i’ve using rosary mint oil month like way feel scalp result bit slow misty sensation refreshing help soothe itchy scalp haven’t noticed significant hair growth yet oil lightweight nice doesn’t make hair greasy feel little heavy use much scent pleasant though might bit strong sensitive misty fragrance 2 ll oz bottle smaller side little go long way run quickly you’re using regularly overall it’s good product scalp health may need patient see noticeable result hair strength growth
110487,3,strong cooking oil smell leaf sticky residue cannot use washing hair like scalp oil expected lightweight still think benefit used applying couple hour prior washing hair managing scalp thoroughly also used soften dry end
110487,3,ok quality decent scent although composed range oil addition rosary peppermint good size however easy use pipette leaned moving bottle scalp decent product prefer pure rosary oil mixed castor oil noticeable hair growth
110487,3,already used month oily hard remove skin scent strong good scent quality seems good bottle full size bottle good guess oil
110487,3,started using 20 day ago every day apply scalp length hair however noticed new faster growth hair break fall much oil give hair extra softness useful scratch hair using get also prevents hair getting greasy dry nice balance smell nice strong beginning smell fade quickly think i'll buy
110487,2,didn’t much hair hair growth used airline month change even combined humectant like aloe vera product lot hope doesn’t live correct supplementation diet pushkin seed oil worked better grow hair make stronger
110487,2,maybe i'm using correctly felt caused hair loss went shower people praise benefit i'm sure quality disappointed maybe sensitive scalp size regular strong scent
110487,2,reading have review product decided purchase give try see could help lesser hair loss ala able use often find product bit oily liking even the use small amount scent okay package size product acceptable however product whereby apply post hair wash go used you’re home since oily even hate soiling pillow due illness purchase
110487,2,almost using whole bottle realized popular product suitable everyone definitely believe main reason lack instruction there's many do's don'to online ended getting lost i'm sure company provide better direction lot research found work best leaving around hour washing shampooing two time turn wash well clot hair follicle end hair loss anyway that's long process someone time twice week far result go can't fattest anything positive negative
110487,1,using month twice week stop hair thinning around part frontal airline stress telogen effluvium know realise til tonight actually made hair loss worse! i'm immediately stopping using back minoxidil hope grows back i'm upset i've lost growth painstakingly gained starting thinking right thing even the needed grow back still put back square one think maybe strong people? risk want push
110487,1,i’m convinced positive review spasm it’s absolutely terrible recommend deep cleanse hair afterwards get oil it’s completely awful going trash it’s far worst hair scalp serum i’ve tried first it’s challenging apply remove dropped oil immediately start dripping everywhere it’s challenging apply directly scalp put palm hand still got hair applying it’s greasy even small amount made freshly washed hair incredibly greasy weighed looked like hadn’t washed awhile perhaps could apply oil washing always convenient b really required deep clean double wash get i’ve attached two photo showing result freshly washed dried hair far better option instead follicle stimulating spray effective spray damp dried hair without noticing style normal they’re greasy
110487,1,finally understand hope! 3 month using see baby hair growing out! noticed little bit difference hair loss keep hope time! scent subtle doesn’t bother scalp le itchy size really good go you’re boiling two time 3 time week looking forward seeing improvement hair next 3 months! edit hair went crazy! realized heavy hair became greasy scalp yet friday too! hair loss increased stopped using
110487,1,read review buy save situation bought entire hair care set saw lot positive review learned important life lesson read low review even ten thousand good review even product ranged first according herb used oil twice first time severe shedding really gathered went searching found many similar case tried apply oil thinking maybe accidental second time shedding even worse i'm writing review seriously make sense product claim strengthen hair ranged number one herb hair product cause hair loss many case recommend buying product especially dealing hair loss end result le hair head le money pocket
6418,5,great get scent feel high quality good composition package pretty good size put shower flop hair shirt used couple time already hair look great would recommend anyone curly hair
6418,5,quality good nice scent use shower put leave conditioned apply hold pretty well size package good price apply top hair don’t put root
6418,5,get best use hair sensitive scalp really great size age quality package strong scent really keep moisture benefit composition really love order
6418,5,package quality size scent composition use r great! lot benefit suit age doesn’t irritate scalp cause hair breakage moisture hold or baby hair couple hour sensitive skin always test usage like giovanni product highly recommend limp hair!
6418,5,product recommended wavy hair influence curl defined leave hard cast however hair frizzier side still get fritz undefined strand tried use style baby hair front find doesn’t give strongest hold still last hour term scent smell like typical get size great last
6418,5,get provides excellent strong hold last throughout day doesn’t leave residue sickness making ideal clean saying formula lightweight wish easily still maintaining control structure great hair type natural ingredient bonus plus subtle scent overpowering perfect anyone looking reliable saying get strong hold!
6418,5,hold saying get made high quality ingredient ensuring strong hold without compromising hair health highly recommend hold saying get strong hold anyone looking reliable effective saying product excellent hold ease use nourishing ingredient make top choice everyday style special occasion whether straight wavy curly hair get help achieve maintain desired look day long
6418,5,delightful scent use every couple day quality package excellent appropriate size age doesn’t hurt hair it’s sensitive type scalp contains ingredient moisturizer hair style beautifully also benefit hair
6418,5,i've using scent subtle refreshing strong easy use providing long lasting strong hold work well throughout day quality impressive hold style without flaming size product great regular use package convenient easy store it’s suitable age group making versatile scalp quite sensitive get doesn’t cause irritation even help moisture hair keeping place benefit product provides hold without compromising hair health
6418,5,sense use daily showering it’s good quality size average packing donna it’s really nice hair doesn’t moisture honest don’t use skull it’s good use love
6418,5,best hair get ever use daughter age 3 7 keep hair moisturized hard rock get keep hair place strong hold hardening showing comb next day residue build nice quality get disturbing scent good size enough long time 100 time buying
6418,5,scent free like use curl definition hope size quantity bigger price quality better get have used would say suitor age use kiss well
6418,5,scent great using sleek but quality good size kind small age last month packing nice clot benefit keep moisture hair add scalp sometimes th use clarifying shampoo time time get builder composition good kind thick ink it’s suitable sensitive hair like
6418,5,it’s color safe parade free cruelty free love scent use leave conditioned fine hair doesn’t weigh hair curl last keep away scalp good quality package clean product benefit hydrate hair
6418,5,here’s 100 word personal review giovanni hold saying get i’ve using giovanni hold saying get week i’m impressed performance provides excellent hold without overlay stiff sticky allowing maintain natural look throughout day get pleasant subtle scent doesn’t lake leave residue appreciate it’s made natural ingredient free harsh chemical great sensitive scalp get also rise easily making convenient daily use overall it’s fantastic product achieving maintaining polished yet flexible hairstyle
6418,5,use every day great quality copy size love package go hair ripe scalp nice scent age tried sensitive skin don’t think it give moisture hug benefit jjvgg john did french composition rich hug such
6418,5,work well saying curl sick back smell amazing make great cast curl give nice definition used hair routine regularly however didn’t put scalp daily didn’t notice hair loss problem
6418,5,began friendly cruelty free giovanni product use number organic ingredient leaping funny terrified cruelty free parade surface free giovanni product contain parade surface harsh chemical typically found hair product leaving strong beautiful hair great size quality work l hold saying get damp dry hair saying go professional finish set l hold hair spirit added shine wash effortlessly warm water end day conditioned feel make want use strongest hair get again!
6418,5,giovanni’s l hold saying get delivers impressive strong hold hairstyle scent subtle keep style place without flaming benefit includes long lasting control definition packing efficient 201 my perfect everyday use reliable choice maintaining strong polished look!
6418,5,talk strong hold curl great get hair recommend anyone looking something similar subtle scent like said work great definition hold use whenever want let hair smooth away fly away
6418,5,love much work amazing suggest u get it! think work amazingly hair it’s best thing got work sensitive hair moisture hair amazingly doesn’t ruin scalp size good scent awesome use rely easy
6418,5,really love giovanni product high quality hair type get absolutely best especially curly hair easy use mother hair moisturizer well gentle sensitive scalp size packing good definitely recommend
6418,5,get nice scent good quality use curly hair keep hair moisturized curl defined package medium size composition smooth good sensitive curl think would benefit curly gillie white heart
6418,5,bought get hoping find cost effective replacement beloved innersense get imagine surprise worked better! strong enough hold create nice curl cast lightweight enough don’t sacrifice volume texture get smooth sticky scent light flora curl come fluffy friday easily brought back life i’m day 3 hair right going strong buying again!
6418,5,i've finally found holy grain saying get one! product delivers promise strong hold without crutch sticky residue keep hair place day long even humid weather love lake leave hair feeling weighed down—it feel natural flexible get also pleasant fragrance scent overpowering plus knowing made organic ingredient cruelty free make feel good using looking reliable saying get actually work care hair look further!
6418,5,i've using saying get curly routine size make last decent time clear package help see i'm running scent discreet greatly appreciated composition easy hair scalp hold shape leave residue unlike similar saying product
6418,5,kind thin wavy hair get used weighed hair tried item giovanni decided give try given good feedback amazing like anything else used help creating curl hair look clean stiff like stick love i'll unload photo next time apply
6418,5,used hair multiple time quality size great need use small amount time packing good time thin little bit water it’s great tame faraway hair
